{"schemaVersion":"dromio.browser-policy.v1","enabledFeatures":["inspect","interaction"],"defaultMode":"disabled","operations":[{"operationId":"browser.page.read","mode":"automatic"},{"operationId":"browser.interaction.click","mode":"approval-required"}],"allowedOrigins":["https://example.test"],"limits":{"maxSessions":2,"maxTabsPerSession":8,"maxArtifactBytes":10485760,"maxEventRecords":1000}}
